{
  "schema": "vela.math.fc-audit.agent-sender-output.v0.1",
  "fixture_id": "fidelity-erdos-887-1237",
  "condition": "same-inputs-plus-fc-pr-audit",
  "packet_root": "sha256:4eec2a078dd0056133412b561e3b7dfc3411fb8b8494615a42d67eee61748cfc",
  "verdict": "needs_revision",
  "issue_codes": [
    "answer_slot_scope"
  ],
  "mechanical_status": "pass",
  "source_fidelity": "fail",
  "artifact_availability": "exact",
  "community_status": "merged",
  "evidence_locators": [
    "FormalConjectures/ErdosProblems/887.lean@288608562e684a2f3c97ba0ce960a2649a71370b",
    "git-blob:6feb58b9272ce638aba6da5ca7ee8ebf7785e0b8",
    "https://github.com/google-deepmind/formal-conjectures/actions/runs/20965023898/job/60275340706",
    "evidence/formal-conjectures/source-adapter/retained-source/audit/pr-audit-v1/fixtures/fidelity-erdos-887-1237/expected-core.json"
  ],
  "witness": "The source asks for one absolute K, but in Erdos887.erdos_887 the answer(sorry) slot appears inside the binders ∀ C > 0 and ∀ᶠ n in atTop. It can therefore depend on each bound C and n; choosing the left-hand divisor count for each instance makes the inequality reflexive, so the statement does not express one absolute K. The exact-head repository build nevertheless passed.",
  "unsupported_claims": [],
  "authority_effect": "none",
  "does_not_establish": [
    "The passing build does not establish source fidelity or mathematical truth.",
    "The approval and merge do not establish acceptance, Vela Standing, or semantic fidelity.",
    "This advisory verdict is not a Formal Conjectures maintainer action or Vela Decision."
  ],
  "next_obligation": "Revise Erdos887.erdos_887 so a single K is existentially quantified outside the C and eventual-n binders, then rerun the mechanical check and obtain an independent fidelity review.",
  "confidence": "high"
}
