{
  "schema": "vela.math.fc-audit.agent-sender-output.v0.1",
  "fixture_id": "conditional-erdos-427-4884",
  "condition": "plain-git-and-current-review-artifacts",
  "packet_root": "sha256:0e0824641f75166903af3a4642d89f01ecdd0ae0b0a46a9512136e0d2bcf5191",
  "verdict": "minor_issues",
  "issue_codes": [
    "conditional_proof_dependency"
  ],
  "mechanical_status": "pass",
  "source_fidelity": "pass",
  "artifact_availability": "exact",
  "community_status": "open",
  "evidence_locators": [
    "FormalConjectures/ErdosProblems/427.lean@601aff40d6fa6c3150242144fadba5dbcc24c89c, theorem erdos_427 attribute and statement",
    "FormalConjectures/ErdosProblems/427.lean@601aff40d6fa6c3150242144fadba5dbcc24c89c, declarations ShiuTheorem and erdos_427.variants.shiu",
    "https://gist.githubusercontent.com/JohnEdwardJennings/e2c6ef0daab55857b7cc9d340de7af84/raw/8ff97800e38582c71246a238e7541a9d69488cbd/Erdos427.lean",
    "github-pr-4884-check-observation.json: check run 93932003906, Build project, success, head 601aff40d6fa6c3150242144fadba5dbcc24c89c",
    "github-pr-4884-files-observation.json: FormalConjectures/ErdosProblems/427.lean, blob 99d781c323fc09d49f688a5bd23722ea2011fd24",
    "github-pr-4884.json: base df1b7937d1d97e6acecb32dfa18b4381fc645c6a, head 601aff40d6fa6c3150242144fadba5dbcc24c89c, state open, merged false"
  ],
  "witness": "The exact statement is `theorem erdos_427 : answer(True) ↔ erdos427`, where `erdos427` quantifies over every `n d : ℕ`, excludes the impossible boundary `d = 0`, and requires a nonempty consecutive-prime sum divisible by `d`. The declared external proof is explicitly marked `conditional formal_proof` and names `erdos_427.variants.shiu`; that declaration has type `ShiuTheorem`. The retained PR description witnesses the dependency by exhibiting the linked proof's Shiu-style axiom. Thus the statement is source-faithful, but the proof claim remains conditional on Shiu's theorem. The exact-head Build project check passed.",
  "unsupported_claims": [
    "The bundle does not independently reproduce or verify the bytes or compilation of the external gist proof.",
    "The PR author's claim that the gist axiom and the set-theoretic `ShiuTheorem` formulation are fully equivalent is supported by the supplied description but not independently mechanically checked here."
  ],
  "authority_effect": "none",
  "does_not_establish": [
    "The successful exact-head build does not establish semantic fidelity, acceptance, merge, or Standing.",
    "The open pull request and its clean mergeability state do not establish maintainer acceptance or Standing.",
    "The conditional proof annotation does not establish an unconditional proof of Erdős Problem 427.",
    "This advisory review is not a Formal Conjectures maintainer action or Vela Decision."
  ],
  "next_obligation": "Independently reproduce the commit-qualified external proof artifact and verify that its only retained mathematical dependency is exactly `erdos_427.variants.shiu`; an unconditional proof would additionally require discharging ShiuTheorem.",
  "confidence": "high"
}
