{
  "schema": "vela.math.fc-audit.agent-sender-output.v0.1",
  "fixture_id": "clean-source-faithful-min-modulus-4829",
  "condition": "plain-git-and-current-review-artifacts",
  "packet_root": "sha256:34f9ce1e77b28e8ebcd9a49f57f4e976a890eabda546594d24ae588b465554fc",
  "verdict": "clean",
  "issue_codes": [],
  "mechanical_status": "pass",
  "source_fidelity": "pass",
  "artifact_availability": "exact",
  "community_status": "merged",
  "evidence_locators": [
    "FormalConjectures/Arxiv/2607.08366/MinModulus.lean@0f8d60f1a5811eb00ad9f12cf8031ee5c1cc215c (blob 4c68a8c3788f805e29588bfefdac1fec079e9193): theorem min_modulus",
    "FormalConjectures/Arxiv/2607.08366/MinModulus.lean@0f8d60f1a5811eb00ad9f12cf8031ee5c1cc215c: definitions IsValidMod and minModulus",
    "FormalConjectures/Arxiv/2607.08366/MinModulus.lean@0f8d60f1a5811eb00ad9f12cf8031ee5c1cc215c: theorem exists_isValidMod_minModulus formal_proof URL pinned to e7c78dd63955092b5f8d8a5fa826476337c0f4be/MinModulus/UniqueSums.lean#L837-L838",
    "github-pr-4829-check-observation.json: Build project check run 93244176232 succeeded for head 0f8d60f1a5811eb00ad9f12cf8031ee5c1cc215c",
    "github-pr-4829-files-observation.json: sole changed file, expected head 0f8d60f1a5811eb00ad9f12cf8031ee5c1cc215c, blob 4c68a8c3788f805e29588bfefdac1fec079e9193",
    "github-pr-4829-reviews.json: APPROVED review 4910223499 on head commit",
    "github-pr-4829.json: base 5fe1f74ad497d950e4c2094879ab10708907f7c6, head 0f8d60f1a5811eb00ad9f12cf8031ee5c1cc215c, merged 2026-08-11T21:39:26Z"
  ],
  "witness": "The answer binder scopes the complete proposition. Its right-hand side states exactly the documented lower-bound conjecture: for every n≥2 and positive N below 2^n−2^(Nat.log 2 n), every n-element finset in ZMod N is not IsValidMod. The explicit 0<N and 2≤n hypotheses exclude the documented ZMod 0 and subsingleton boundary cases without making the quantified domain vacuous. The complementary existence theorem is separately stated and carries a commit-pinned proof locator.",
  "unsupported_claims": [],
  "authority_effect": "none",
  "does_not_establish": [
    "The successful repository build establishes neither source-statement fidelity nor mathematical truth.",
    "The exact external proof locator does not by itself establish that its proof bytes were independently reproduced in this review.",
    "Approval and merge are community observations, not acceptance, Formal Conjectures Standing, or a Vela Verification, Decision, or Standing.",
    "This advisory review has no authority effect."
  ],
  "next_obligation": null,
  "confidence": "high"
}
