{
  "schema": "vela.math.fc-audit.agent-sender-output.v0.1",
  "fixture_id": "fidelity-erdos-887-1237",
  "condition": "same-inputs-plus-fc-pr-audit",
  "packet_root": "sha256:4eec2a078dd0056133412b561e3b7dfc3411fb8b8494615a42d67eee61748cfc",
  "verdict": "needs_revision",
  "issue_codes": [
    "answer_slot_scope"
  ],
  "mechanical_status": "pass",
  "source_fidelity": "fail",
  "artifact_availability": "exact",
  "community_status": "merged",
  "evidence_locators": [
    "FormalConjectures/ErdosProblems/887.lean@288608562e684a2f3c97ba0ce960a2649a71370b",
    "git-blob:6feb58b9272ce638aba6da5ca7ee8ebf7785e0b8",
    "github-check-run:60275340706",
    "https://github.com/google-deepmind/formal-conjectures/pull/1237",
    "expected-core.json#checks/answer-slot-scope"
  ],
  "witness": "The docstring asks for one absolute constant K valid for every C>0 and all sufficiently large n, but Erdos887.erdos_887 places answer(sorry) after the C and eventual-n binders. The answer slot can therefore vary with each bound instance; choosing the left-hand divisor count makes each instance close by reflexivity, so the statement does not express one absolute K. The exact-head Build project check passed, while Erdos887.erdos_887.variant_i demonstrates the intended outer existential form.",
  "unsupported_claims": [],
  "authority_effect": "none",
  "does_not_establish": [
    "The passing exact-head build does not establish semantic fidelity or mathematical truth.",
    "The GitHub approval and merge do not establish acceptance, Vela Standing, or maintainer endorsement of this advisory verdict.",
    "The retained audit disposition is advisory and does not establish a merge decision."
  ],
  "next_obligation": "Revise Erdos887.erdos_887 so the answer constant is selected outside the C and n binders, then rerun the exact-head build and obtain an independent semantic-fidelity review.",
  "confidence": "high"
}
