{
  "schema": "vela.math.fc-audit.agent-sender-output.v0.1",
  "fixture_id": "fidelity-erdos-887-1237",
  "condition": "plain-git-and-current-review-artifacts",
  "packet_root": "sha256:702406f0ae0aaa12a8c31f64aecd19809253af52dc1ac615ec5fca723242dc88",
  "verdict": "inconclusive",
  "issue_codes": [
    "exact_artifact_identity_unavailable"
  ],
  "mechanical_status": "pass",
  "source_fidelity": "inconclusive",
  "artifact_availability": "unavailable",
  "community_status": "merged",
  "evidence_locators": [
    "FormalConjectures/ErdosProblems/887.lean@288608562e684a2f3c97ba0ce960a2649a71370b (blob 6feb58b9272ce638aba6da5ca7ee8ebf7785e0b8)",
    "Erdos887.erdos_887",
    "Erdos887.erdos_887.variant_i",
    "Erdos887.erdos_887.variant_ii",
    "Erdos887.erdos_887.variant_iii",
    "evidence/formal-conjectures/audit-pilot/source-snapshots/github-pr-1237-check-observation.json#check-run-60275340706",
    "evidence/formal-conjectures/audit-pilot/source-snapshots/github-pr-1237-reviews.json#review-3656943019",
    "evidence/formal-conjectures/audit-pilot/source-snapshots/github-pr-1237.json"
  ],
  "witness": "The inline source wording asks for one absolute K before every C>0, and variant_i encodes exactly ∃ K, ∀ C > 0, eventually count ≤ K. The primary answer-slot theorem uses answer(sorry) without referencing C, so the supplied bytes do not witness an answer-slot scope change. The integer Ioo bounds with floor and ceiling represent the corresponding strict real interval. However, the bundle supplies only the Lean file's link to erdosproblems.com/887 and its attribution that Erdős and Rosenfeld proved variant_ii; it supplies neither the cited page's contents nor an exact paper/proof identity, so independent source fidelity and that external proof claim cannot be verified. Separately, GitHub check run 60275340706 reports a successful Build project check on the exact head, and the PR snapshot reports merge commit 21eefec13ae34f35a2fa30069e023a916a32e9d2.",
  "unsupported_claims": [
    "The attribution that Erdős and Rosenfeld proved the variant_ii infinitude statement is not backed by an exact external proof artifact in the supplied bundle.",
    "Equivalence to the independently cited erdosproblems.com/887 source cannot be established because that source's contents are absent."
  ],
  "authority_effect": "none",
  "does_not_establish": [
    "The successful hosted build is not a local reproduction and does not establish semantic fidelity, mathematical truth, acceptance, or Standing.",
    "The exact-head approval and merged pull request are external community status only; they do not establish acceptance or Standing.",
    "The four by sorry bodies do not constitute proofs of the mathematical statements."
  ],
  "next_obligation": "Retain the exact contents and identity of the cited Erdős Problem 887 source and the Erdős–Rosenfeld proof artifact, then compare their quantifiers, interval endpoints, domain, and infinitude claims against the commit-qualified Lean statements.",
  "confidence": "high"
}
