{
  "schema": "vela.math.fc-audit.agent-sender-output.v0.1",
  "fixture_id": "unavailable-rupert-3959",
  "condition": "plain-git-and-current-review-artifacts",
  "packet_root": "sha256:d40a3055e847bdad2a040402ac042ce5b1a108bc5f2c5e1f17ec5633cb9d6b4a",
  "verdict": "unavailable",
  "issue_codes": [
    "exact_artifact_identity_unavailable"
  ],
  "mechanical_status": "pass",
  "source_fidelity": "pass",
  "artifact_availability": "unavailable",
  "community_status": "merged",
  "evidence_locators": [
    "FormalConjectures/Paper/Rupert.lean@868cc092aeb713dbf8027883c5fa575e550cfae9#theorem is_every_convex_polyhedron_rupert",
    "git-blob:48c343f0d12c1dffb7953a5d2426e0d13a914bad",
    "github-check-run:75175625578@868cc092aeb713dbf8027883c5fa575e550cfae9",
    "github-pr:google-deepmind/formal-conjectures#3959 base=99ae49df4b27d9d95877c562ab9e1fd9b7ff1dc7 head=868cc092aeb713dbf8027883c5fa575e550cfae9",
    "https://github.com/jcreedcmu/Noperthedron"
  ],
  "witness": "The exact Lean statement is `answer(False) ↔ ∀ vertices, (interior (convexHull ℝ vertices)).Nonempty → IsRupert vertices`, matching the stated negative answer that not every convex polyhedron with nonempty interior is Rupert. The head repository build check passed. However, the declared formal-proof locator is only a mutable repository root and supplies neither an immutable revision nor an exact proof file, so the claimed external proof artifact cannot be identified or reproduced exactly from this packet.",
  "unsupported_claims": [
    "That the mutable Noperthedron repository root identifies the exact proof artifact used for this declaration.",
    "That the passing repository build verifies the identity or contents of the external formal proof.",
    "That approval or merge confers acceptance or Standing."
  ],
  "authority_effect": "none",
  "does_not_establish": [
    "The passing GitHub build does not establish external proof-artifact identity, source fidelity by itself, acceptance, or Standing.",
    "The APPROVED review applies to an earlier commit and does not establish acceptance or Standing.",
    "The merged pull request is community status only and does not establish acceptance or Standing.",
    "This advisory review is not a Formal Conjectures maintainer action or Vela Decision."
  ],
  "next_obligation": "Provide an immutable Noperthedron revision and exact proof-file/theorem locator, then reproduce or inspect that artifact against the declared Lean statement.",
  "confidence": "high"
}
