{
  "schema": "vela.math.fc-audit.agent-sender-output.v0.1",
  "fixture_id": "clean-source-faithful-min-modulus-4829",
  "condition": "same-inputs-plus-fc-pr-audit",
  "packet_root": "sha256:57d3fb334b9dc03a80b50f89fda9377aa7c2fa0c563573a532cc260a97317caa",
  "verdict": "clean",
  "issue_codes": [],
  "mechanical_status": "pass",
  "source_fidelity": "pass",
  "artifact_availability": "exact",
  "community_status": "merged",
  "evidence_locators": [
    "FormalConjectures/Arxiv/2607.08366/MinModulus.lean@0f8d60f1a5811eb00ad9f12cf8031ee5c1cc215c",
    "sha256:abb822a6dd603f95a9c9d773c199399222539c9cd91c8a124a3cc5429d9da416",
    "https://github.com/google-deepmind/formal-conjectures/pull/4829#issuecomment-5227429390",
    "https://github.com/google-deepmind/formal-conjectures/pull/4829#pullrequestreview-4910223499",
    "https://github.com/google-deepmind/formal-conjectures/actions/runs/31313208430/job/93244176232",
    "https://github.com/jarfo/min-modulus/blob/e7c78dd63955092b5f8d8a5fa826476337c0f4be/MinModulus/UniqueSums.lean#L837-L838"
  ],
  "witness": "At the exact head, min_modulus states that for every n ≥ 2 and positive N below 2^n − 2^(Nat.log 2 n), every n-element subset of ZMod N is not IsValidMod. This matches the documented Conjecture 1; the N > 0 guard excludes ZMod 0, for which the retained source identifies {1, 2} as a counterexample. The source author explicitly judged the statement faithful, and the reviewed theorem bytes are identical to the exact head. The exact-head repository build check passed.",
  "unsupported_claims": [],
  "authority_effect": "none",
  "does_not_establish": [
    "mathematical truth of Conjecture 1",
    "acceptance or Standing",
    "Vela Verification or Decision",
    "source fidelity beyond MinModulus.min_modulus",
    "proof correctness of the separately declared solved theorem",
    "that unlisted checks ran"
  ],
  "next_obligation": null,
  "confidence": "high"
}
